{
  "paper": {
    "paper_id": "paper_hanlon_2025_jama",
    "doi": "10.1001/jama.2024.27402",
    "title": "Effectiveness of glucose-lowering drugs in older adults with type 2 diabetes: a network meta-analysis",
    "authors": [
      "Hanlon et al."
    ],
    "journal": "JAMA",
    "year": 2025,
    "source_type": "journal_article",
    "open_access": true
  },
  "spans": [
    {
      "span_id": "span_001",
      "paper_id": "paper_hanlon_2025_jama",
      "section_type": "RESULTS",
      "section_name": "Glycemic outcomes",
      "page": 1,
      "char_start": 0,
      "char_end": 190,
      "text": "Across 592 randomized clinical trials including 309,503 participants, SGLT2 inhibitors reduced HbA1c in adults with type 2 diabetes. The magnitude of the effect was smaller at older ages.",
      "table_id": null,
      "figure_id": null,
      "caption_id": null
    }
  ],
  "claims": [
    {
      "claim_id": "claim-48b77d266b70",
      "paper_id": "paper_hanlon_2025_jama",
      "claim_text": "SGLT2 inhibitors reduced HbA1c in adults with type 2 diabetes.",
      "subject": {
        "value": "SGLT2 inhibitors",
        "entity_type": "chemical",
        "ontology": {
          "annotation_type": "mapping",
          "raw_text": "SGLT2 inhibitors",
          "normalized_text": "SGLT2 inhibitors",
          "mapping_status": "mapped",
          "candidate_mappings": [
            {
              "ontology_source": "demo_biomed",
              "ontology_id": "DB:0001",
              "ontology_label": "SGLT2 inhibitors",
              "match_type": "exact",
              "confidence": 0.98
            }
          ],
          "selected_mapping": {
            "ontology_source": "demo_biomed",
            "ontology_id": "DB:0001",
            "ontology_label": "SGLT2 inhibitors",
            "match_type": "exact",
            "confidence": 0.98
          },
          "mapping_method": "dictionary_plus_context"
        }
      },
      "predicate": {
        "value": "reduced",
        "entity_type": "predicate",
        "ontology": {
          "annotation_type": "mapping",
          "raw_text": "reduced",
          "normalized_text": "decreases",
          "mapping_status": "mapped",
          "candidate_mappings": [
            {
              "ontology_source": "demo_relation",
              "ontology_id": "REL:decreases",
              "ontology_label": "decreases",
              "match_type": "exact",
              "confidence": 0.99
            }
          ],
          "selected_mapping": {
            "ontology_source": "demo_relation",
            "ontology_id": "REL:decreases",
            "ontology_label": "decreases",
            "match_type": "exact",
            "confidence": 0.99
          },
          "mapping_method": "normalization_rule"
        }
      },
      "object": {
        "value": "HbA1c in adults with type 2 diabetes",
        "entity_type": "clinical_measure",
        "ontology": {
          "annotation_type": "mapping",
          "raw_text": "HbA1c in adults with type 2 diabetes",
          "normalized_text": "HbA1c in adults with type 2 diabetes",
          "mapping_status": "mapped",
          "candidate_mappings": [
            {
              "ontology_source": "demo_biomed",
              "ontology_id": "DB:0002",
              "ontology_label": "HbA1c in adults with type 2 diabetes",
              "match_type": "exact",
              "confidence": 0.95
            }
          ],
          "selected_mapping": {
            "ontology_source": "demo_biomed",
            "ontology_id": "DB:0002",
            "ontology_label": "HbA1c in adults with type 2 diabetes",
            "match_type": "exact",
            "confidence": 0.95
          },
          "mapping_method": "dictionary_plus_context"
        }
      },
      "claim_kind": "result",
      "claim_profile": "intervention_effect_result",
      "epistemic_status": "empirical",
      "support_origin": "own_results",
      "source_span_ids": [
        "span_001"
      ],
      "context": {
        "population": {
          "value": "adults with type 2 diabetes",
          "entity_type": "population",
          "ontology": null
        }
      },
      "details": {},
      "extractor_confidence": 0.94
    }
  ],
  "evidence_items": [
    {
      "evidence_id": "ev_001",
      "paper_id": "paper_hanlon_2025_jama",
      "role": "supports",
      "summary_text": "Across 592 randomized clinical trials including 309,503 participants, SGLT2 inhibitors reduced HbA1c.",
      "evidence_method": {
        "value": "meta_analysis",
        "entity_type": "evidence_method",
        "ontology": null
      },
      "outcome_type": {
        "value": "clinical_outcome",
        "entity_type": "outcome_type",
        "ontology": null
      },
      "presentation_type": {
        "value": "text",
        "entity_type": "presentation_type",
        "ontology": null
      },
      "source_span_ids": [
        "span_001"
      ],
      "context": {
        "population": {
          "value": "adults with type 2 diabetes",
          "entity_type": "population",
          "ontology": null
        }
      },
      "details": {
        "outcome_name": "HbA1c",
        "study_count": 592,
        "sample_size": 309503
      },
      "ontology": null
    },
    {
      "evidence_id": "ev_002",
      "paper_id": "paper_hanlon_2025_jama",
      "role": "qualifies",
      "summary_text": "The magnitude of the effect was smaller at older ages.",
      "evidence_method": {
        "value": "meta_analysis",
        "entity_type": "evidence_method",
        "ontology": null
      },
      "outcome_type": {
        "value": "clinical_outcome",
        "entity_type": "outcome_type",
        "ontology": null
      },
      "presentation_type": {
        "value": "text",
        "entity_type": "presentation_type",
        "ontology": null
      },
      "source_span_ids": [
        "span_001"
      ],
      "context": {
        "population": {
          "value": "older adults",
          "entity_type": "population",
          "ontology": null
        }
      },
      "details": {
        "outcome_name": "HbA1c"
      },
      "ontology": null
    }
  ],
  "claim_evidence_links": [
    {
      "link_id": "link_001",
      "claim_id": "claim-48b77d266b70",
      "evidence_id": "ev_001",
      "relation": "supports",
      "confidence": 0.97
    },
    {
      "link_id": "link_002",
      "claim_id": "claim-48b77d266b70",
      "evidence_id": "ev_002",
      "relation": "qualifies",
      "confidence": 0.91
    }
  ]
}
